Ingredients,Rate,Category,Information
"1, 2-Hexanediol",GOOD,Preservatives,"A synthetic preservative and moisture-binding agent belonging to a class of agents known as higher molecular glycols. It is considered non-sensitizing. 
See preservatives
References for this information:
International Journal of Toxicology, September-October 2012, pages 147S-168S
International Journal of Cosmetic Science, October 2011, pages 421-425
Cutaneous and Ocular Toxicology, Volume 28, 2009, pages 23-24"
10-Hydroxydecanoic Acid,GOOD,Emollients,A synthetic ingredient that functions as a skin-conditioning and occlusive agent.
4-T-butylcyclohexanol,GOOD,Emollients,"A synthetic fatty alcohol that functions as an emollient and soothing agent. It can reduce skin surface stinging on contact and also has the ability to reduce visible redness on skin.
References for this information:
Journal of the European Academy of Dermatology and Venereology, February 2016, pages 9-16; and Volume 30 Supplement, pages 21-27
Experimental Dermatology, November 2010, pages 980-986."
Acacia farnesiana extract,POOR,Plant Extracts,A fragrant extract from a type of acacia tree. There is no research showing it to have any benefit for skin.
acacia senegal gum,GOOD,Texture Enhancer,"Herb that can have skin soothing properties, but is used primarily as a thickening agent."
acai,BEST,Antioxidants,"Acai (pronounced “ah-sigh-ee”) is a small berry with a deep purple color. It is a potent source of antioxidants, including ferulic acid and epicatechin. According to in vitro research, açai has higher antioxidant content than cranberry, raspberry, blackberry, strawberry, or blueberry, but that doesn’t necessarily mean it is the best antioxidant—just one of many to choose from when it comes to your skincare products.
References for this information:
Journal of Drugs in Dermatology, June 2010, pages 72-81
Journal of Agricultural and Food Chemistry, November 2006, pages 8604-8610"
acerola fruit extract,GOOD,Plant Extracts,"Acerola contains vitamin C. However, the dry acerola fruit and powder are unlikely to be a good source of vitamin C because much of the vitamin C is destroyed during the drying and processing."
acetic acid,POOR,Sensitizing,"Acid found in vinegar, some fruits, and human sweat. It can be sensitizing to skin, though it also has disinfecting properties."
acetone,POOR,Sensitizing,Strong solvent that is used in nail polish removers.
acetylated castor oil,GOOD,Texture Enhancer,Used as an emollient and thickening agent in cosmetics.
acetylated hydrogenated cottonseed glyceride,GOOD,Texture Enhancer,Used as an emollient and thickening agent in cosmetics.
acetylated lanolin,GOOD,Emollients,Emollient derived from lanolin.
acetylated lanolin alcohol,GOOD,Emollients,"An ester of lanolin alcohol uses as an emollient and occlusive agent. An ester is a compound formed from an alcohol and an acid with the elimination of water, and are common among cosmetic ingredients."
acetylated palm kernel glycerides,GOOD,Texture Enhancer,Used as an emollient and thickening agent in cosmetics.
acetyl carnitine HCL,BEST,Antioxidants,none
acetyl glucosamine,BEST,Skin-Replenishing,"Amino acid sugar and primary constituent of mucopolysaccharides and hyaluronic acid. Acetyl glucosamine is a skin-replenishing ingredient that can have considerable value in cosmetic products aimed at diminishing signs of aging.
In terms of this ingredient prompting exfoliation, the research that exists was performed by Proctor & Gamble and by Estee Lauder, and both companies sell skincare products that contain acetyl glucosamine. 
Acetyl glucosamine also has research demonstrating that it can have skin-brightening benefits, particularly when combined with the B vitamin, niacinamide. 
Most of the research concerning acetyl glucosamine’s effect on uneven skin tone is from Procter & Gamble, as their Olay brand uses acetyl glucosamine in select products. Still, the research is compelling and the protocols are sound, so it can be applied to other formularies that utilize this ingredient.
References for this information:
International Journal of Cosmetic Science, October 2013, pages 472-476
British Journal of Dermatology, February 2010, pages 435-441
Journal of Cosmetic Science, July-August 2009, pages 423-428
Journal of Cosmetic Dermatology, March 2007, pages 20-26; and December 2006, pages 309-315"
acetyl glyceryl ricinoleate,GOOD,Texture Enhancer,Used as an emollient and thickening agent in cosmetics.
acetyl hexapeptide-8,GOOD,Skin-Restoring,"Acetyl hexapeptide-8 is a synthetically derived peptide that is used in a wide range of skincare and makeup products.
Despite claims being made for acetyl hexapeptide-8 (argireline), there is a clinical study revealing that this ingredient is not even remotely as effective as dermatological procedures in reducing signs of aging.
Other studies on topical use of a moisturizer containing a 10% concentration of acetyl hexapeptide-8 have shown it does not penetrate beyond the uppermost layers of skin, even after several hours. That means it cannot affect factors in the underlying layers that lead to the formation of expression lines. 
On the other hand, research has shown this peptide can penetrate further into skin if specific formulary steps are followed, including the type of emulsion (a higher water content showed greater penetration). However, even then the peptide wasn’t showing results equivalent to cosmetic corrective procedures. 
Still, like all peptides, acetyl hexapeptide-8 has water-binding properties and theoretical skin-restoring ability. It’s not a throwaway ingredient, but neither is it as miraculous as the manufacturer would lead you to believe.
References for this information:
Cutaneous and Ocular Toxicology, March 2015, pages 46-52
European Journal of Pharmaceutical Sciences, February 2015, pages 27-35
Dermatologic Therapy, September-October 2007, issue 5, pages 343-349
International Journal of Cosmetic Science, October 2002, issue 5, pages 303-310"
acetyl octapeptide-3,GOOD,Skin-Restoring,"Synthetic peptide that is based around octapeptide-3, a peptide complex composed of the amino acids aspartic acid, glutamic acid, glutamine, and methionine. Also known as SNAP-8, this peptide is said to improve the look of signs of aging formed from repetitive facial expressions, though there’s no independent research supporting this claim.
Even if there were independent research, the concentrations used in the company-sponsored testing to support the improvement of signs of aging was 3–10%, which is far greater than what’s typically present in skincare products. Like all peptides it has water-binding properties and theoretical skin-restoring ability. It may play a role in helping skin look younger, and can help hydrate and smooth skin."
acetyl tributyl citrate,AVERAGE,Film-Forming/Holding Agents,"Related to citric acid and used as a plasticizer, most commonly in nail polish and nail-hardening products."
acetyl tyrosine,GOOD,Hydration,An amino acid complex that functions as a skin-conditioning agent. There is no research proving it has a restoring or brightening effect on skin.
Achillea millefolium,POOR,Skin-Soothing,none
acid,AVERAGE,Miscellaneous,Anything with a pH lower than 7 is considered acidic—above 7 is considered alkaline. Water has a pH of 7. Skin has an average pH of 5.5
acne soap,POOR,Cleansing Agents,"Soaps that often contain strong cleansing ingredients, they are often overly drying and sensitizing to skin."
acrylate,GOOD,Texture Enhancer,none
acrylates/C10-30 alkyl acrylate crosspolymer,GOOD,Texture Enhancer,"A synthetic ingredient used to enhance the texture of skincare and haircare products. The Cosmetic Ingredient Review has deemed it safe as it is currently used in cosmetics.
Reference for this information:
Cosmetic Ingredient Review Final Safety Assessment, November 2011 - http://www.cir-safety.org/sites/default/files/crossl092011final_for%20posting.pdf"
acrylates/dimethicone copolymer,GOOD,Silicones,Silicone-enhanced film-forming agent. Also functions as a binding agent so products adhere better to skin.
acrylates/steareth-20 methacrylate copolymer,GOOD,Texture Enhancer,Synthetic polymer that blends steareth-20 with one or more forms of methacrylic acid. Functions as a thickening agent.
acrylates copolymer,GOOD,Texture Enhancer,none
Actaea racemosa,AVERAGE,Plant Extracts,none
adenosine,BEST,Skin-Soothing,"Yeast-derived ingredient that functions as a good soothing and skin-restoring agent. Adenosine has proven anti-wrinkle benefits due to its ability to energize skin’s surface so it looks smoother and younger. Naturally present throughout the body, adenosine is a beneficial ingredient all skin types can use.
References for this information:
Experimental Dermatology, August 2014, pages 553-554
International Journal of Cosmetic Science, December 2006, pages 447-451
British Journal of Pharmacology, October 2008, issue 4, pages 475-486
PloS One, May 2008 (ePublication: http://journals.plos.org/plosone/article?id=10.1371/journal.pone.0002107)"
adenosine triphosphate,BEST,Skin-Soothing,"Organic compound from adenosine, which is formed by the hydrolysis of yeast nucleic acids.
Research has shown that ATP appears to have strong potential as a skin-restoring ingredient and as a soothing agent.
References for this information:
Journal of Cutaneous Medicine and Surgery, March-April 2004, issue 2, pages 90-96"
adipic acid/neopentyl glycol/trimellitic anhydride copolymer,GOOD,Texture Enhancer,A synthetic polymer.
advanced glycation endproduct (AGE),POOR,Miscellaneous,"Advanced glycation end-products (AGEs) are destructive substances generated in the body when we consume refined sugars and due to environmental exposure without adequate protection. But first, a bit of backstory…
One of the more depressing skincare facts we can think of is how bad dietary sugar or high glycemic index foods (foods that turn to sugar almost immediately after eating them) are for almost every aspect of your skin. Chocolate cake, honey-drenched sweets, ice cream sundaes, bread pudding, and on and on (and we could go on and on) cause very bad things to happen to skin. UV light and air pollutants are attacking your skin from the outside in, and sugar is attacking it from the inside out.
What’s the relationship between sugar and AGEs? Sugars quickly and strongly bind to proteins in the skin (proteins are the main building blocks of skin) forming AGEs that progressively and continually destroy many aspects of skin, especially elastin and collagen, the two substances that give skin its firmness and resilience. Once generated, AGEs begin a cascade of progressive damage that isn’t easy to stop or reverse.
Research has also shown AGEs can cause abnormal melanin production that leads to the formation of brown spots and mottled skin discolorations. Another ironic acronym for this is RAGEs, meaning a receptor site for AGEs that induces unhealthy melanin production.
Although sugar is certainly a major culprit in the skin-damaging creation of AGEs, so is something called the Maillard Reaction (MR). The Maillard Reaction is what happens when you cook any food and brown or blacken it with high heat. That means steaming or sautéing food without browning is far healthier for your skin and body. And chargrilling foods, especially meats, at high heat is even worse! Our apologies to those who prefer their steaks well done.
While some skincare companies claim their products contain ingredients that can block AGEs from forming, that benefit hasn’t been supported anywhere in the research. In the meantime, while science is working on this insidious problem, eating a low sugar diet that’s rich in antioxidants, complex carbohydrates, and omega fatty acids is by far the best approach for younger-looking, healthy skin from the inside out (and when you put those ingredients on your skin it can help from the outside in too, it’s just not clear how much that helps control the visible effects of AGEs; however, a huge amount of research shows those ingredients to be beneficial for skin overall).
What about the occasional sweet treat? Although we can’t change what eating refined sugars does to your skin (and yes, this includes so-called sugar substitutes like raw honey and agave nectar, both of which the body recognizes as simple sugars), we also realize that sweets play a role in the pleasures of eating and celebrating. The trick is to keep it in moderation, meaning an occasional, judicious indulgence rather than daily consumption of desserts, sugary sodas, and flavored coffee drinks, the latter of which can contain an alarming amount of sugars.
References for this information:
Journal of Agricultural Food Chemistry, February 2018, pages 1,325-1,329
Advances in Nutrition, January 2017, pages 54-62
Dermato-endocrinology, October 2017, page 9
Skin Pharmacology and Physiology, May 2016, pages 231-242
Skin Therapy Letter, November 2015, pages 1-5
Clinical Chemistry and Laboratory Medicine, January 2014, pages 169-174
Proceedings of the National Academy of Sciences, March 14, 2000, pages 2809–2813."
Aerocarpus santalinus,POOR,Plant Extracts,none
Aesculus hippocastanum,GOOD,Skin-Soothing,none
agar,GOOD,Antioxidants,none
AGE,POOR,Miscellaneous,none
Agrimonia eupatoria leaf extract,AVERAGE,Antioxidants,"Research shows this plant extract has antioxidant properties. Whether or not it has a benefit when applied topically is not known.
References for this information:
Journal of Ethnopharmacology, January 2005, issue 3, pages 145-150"
AHA,BEST,Exfoliant,"Acronym for alpha hydroxy acid. AHAs are derived naturally from various plant sources and from milk, but 99% of the AHAs used in cosmetics are synthetically derived. In low concentrations (less than 3%), AHAs work as water-binding agents. At concentrations greater than 4% and in a base with an acid pH of 3 to 4, these ingredients can exfoliate by breaking down the substance that holds dead skin together.
The most effective and well-researched AHAs are glycolic acid and lactic acid. Malic acid, citric acid, and tartaric acid may also be effective.
AHAs may sensitize mucous membranes. However, AHAs have been widely used for improving signs of aging, dry skin and an uneven skin tone, all of which lead to younger-looking skin.
There is a vast amount of research that substantially describes how the aging process affects skin and that demonstrates that many of the unwanted changes can be improved by topical application of AHAs, including glycolic and lactic acids. AHA use can result in increased sensitivity to the sun, though wearing a sunscreen daily eliminates this risk.
Note: AHAs are of little benefit when added to rinse-off products, as their contact with skin is too brief for them to function as exfoliants or absorb into skin.
References for this information:
Jundishapur Journal of Natural Pharmaceutical Products, January 2012, pages 9-10
Evidence Based Complementary and Alternative Medicine, June 2011, ePublication"
Ahnfeltia concinna extract,GOOD,Antioxidants,none
ahnfeltia extract,GOOD,Antioxidants,none
Ahnfeltiopsis concinna extract,GOOD,Emollients,"Type of red algae with calming and hydrating properties for skin.
Reference for this information:
International Journal of Cosmetic Dermatology, September 2012, pages 207-212"
alanine,GOOD,Antioxidants,none
Alaria esculenta,GOOD,Antioxidants,none
albumin,POOR,Texture Enhancer,"Found in egg white, and can leave a film over skin. It can constrict skin temporarily, which can make it look smoother temporarily, but it can also cause sensitivity and is not helpful for skin."
alcloxa,POOR,Uncategorized,"More technically known as aluminum chlorhydroxy allantoinate, alcloxa has constricting properties that can be sensitizing to skin."
alcohol,AVERAGE,Emollients,"""Alcohol"" refers to a group of organic compounds with a vast range of forms and uses in cosmetics and in other types of products and solutions. 
For skin, there are good alcohols and bad alcohols, corresponding to high-molecular-weight alcohols and low-molecular-weight alcohols, respectively, which can have emollient properties (cetyl alcohol) or act as detergent cleansing agents like isopropanol. 
There also are benign forms, including glycols, which are used as humectants to help hydrate and deliver ingredients into skin’s uppermost layers.
Alcohols with low molecular weights—the bad-for-skin kind—can be drying and sensitizing. The alcohols to be concerned about in skincare products are ethanol or ethyl alcohol, denatured alcohol, methanol, isopropyl alcohol, SD alcohol, and benzyl alcohol. The concern is when one or more of these are listed among the main ingredients; tiny amounts in an otherwise good formula aren’t a problem.
In addition to being drying and sensitizing, these alcohols can disrupt skin’s surface layers. Alcohol helps ingredients like retinol and vitamin C penetrate into the skin more effectively, but it does that by breaking down the surface layers of skin—destroying the very substances that keep your skin feeling healthier and looking younger over the long term.
Alcohols like SD and ""denatured"" immediately harm the skin, starting a chain reaction of damage that continues long after it has evaporated. A 2003 study published found that with regular exposure to alcohol-based products, cleansing becomes a damaging ordeal—skin is no longer able to keep water and cleansing agents from penetrating into it, thus further eroding its surface layers.
It also destroyed the substances in skin that help to naturally soothe and defend it against visible effects of environmental damage.
If that weren’t bad enough, exposure to alcohol causes healthy substances in skin to literally self-destruct. The research also showed that these destructive, aging effects on skin’s substances increased the longer the exposure to alcohol; that is, two days of exposure was dramatically more harmful than one day, and that is only from exposure to a 3% concentration (most skincare products with denatured alcohol contain greater amounts than that).
In short, for the healthy appearance of skin at any age, avoiding products that contain high amounts of the drying, sensitizing types of alcohol is a non-negotiable skincare must.
References for this information:
Biochimica et Biophysica Acta, May 2012, issue 4, page 1410
Aging, March 2012, issue 3, pages 166-175
Chemical Immunology and Allergy, March 2012, pages 77-80
Dermato-Endocrinology, January 2011, issue 1, pages 41-49
Journal of Occupational Medicine and Toxicology, November 2008, issue 3
Experimental Dermatology, June 2008, issue 6, pages 542-551
Clinical Dermatology, September-October 2004, issue 5, pages 360-366
The Journal of Hospital Infection, December 2003, issue 4, pages 239-245
Alcohol Journal, April 2002, issue 3, pages 179-190"
Aleurites moluccana seed oil,BEST,Plant Extracts,none
alfalfa extract,BEST,Antioxidants,"Can be an antioxidant in skincare products.
References for this information:
Journal of Agricultural Food Chemistry, January 2001, issue 1, pages 308–314"
algae,GOOD,Antioxidants,"Algae are very simple, chlorophyll-containing organisms in a family that includes more than 20,000 different known species. In cosmetics, algae act as thickening agents, water-binding agents, and antioxidants.
Some algae are also potential skin sensitizers. For example, the phycocyanin present in blue-green algae has been suspected of sensitization on the basis of patch tests.
Other forms of algae, such as Irish moss and carrageenan, contain proteins, vitamin A, sugar, starch, vitamin B1, iron, sodium, phosphorus, magnesium, copper, and calcium. Most of these are beneficial for skin, as emollients, soothing agents, or antioxidants.
New research shows forms of brown algae show promise for improving the appearance of aging skin. As a plant ingredient, all types of algae are prone to breaking down with routine exposure to air and light. Because of this, avoid anti-aging products with algae that are packaged in jars.
References for this information:
Bioresource Technology, May 2015, pages 355-362
Marine Pharmacognosy: Trends and Applications, 2013
Marine Drugs, January 2013, pages 146-164"
algae extract,GOOD,Antioxidants,none
algin,GOOD,Antioxidants,Brown algae.
aliphatic hydrocarbon,GOOD,Uncategorized,Hydrocarbon contained in natural gas and mineral oils. It is a synthetic fluid with varying properties.
alkaline,POOR,Uncategorized,"Anything with a pH higher than 7 is alkaline; a pH below 7 is acidic. Water has a pH of 7; skin has an average pH of 5.5. Skin sensitization can be caused by products with a pH of 8 or higher. Also, research indicates that the bacteria on skin proliferates in alkaline environmental.
References for this information:
eMedicine Journal, January 7, 2002, volume 3, number 1
Cutis, December 2001, Supplemental, pages 12–19"
alkyloamides,AVERAGE,Texture Enhancer,"Identified on skincare product labels as DEA, triethanolamine (TEA), and monoethanolamine (MEA), these are used primarily for their foaming ability in shampoos, but can also be used as thickening or binding agents. They can be skin sensitizers. In addition, alkyloamides contain a free amine that can combine with formaldehyde-releasing preservatives in cosmetics, and there is concern that they may form harmful substances."
allantoin,BEST,Skin-Soothing,"By-product of uric acid extracted from urea and considered an effective skin-soothing and skin-conditioning agent. Allantoin occurs naturally in the body. It can be extracted from plants (comfrey, chamomile) or made synthetically—the most common method for inclusion in cosmetics where it’s used in concentrations upwards of 2%.
Reference for this information:
Pharmacognosy Review, Volume 5, July-December 2011
International Journal of Toxicology, May 2010, Supplement, pages 84S-97S
Journal of Occupational Medicine and Toxicology, October 2008, ePublication"
allyl methacrylates crosspolymer,GOOD,Texture Enhancer,"Synthetic, non-aqueous polymer whose chief function is as a texture enhancer."
almond oil,BEST,Emollients,"Also known as sweet almond oil, this is a non-volatile, non-fragrant oil extracted from the seeds of almonds and used as an emollient. Almond oil is a rich source of skin-replenishing ingredients including triglycerides and several fatty acids (oleic, linoleic, and myristic among them). It is not known to cause sensitivity.
Almonds (Prunus amygdalus) can be sweet or bitter. Sweet almond is listed in Latin as Prunus amygdalus or Prunus dulcis and does not contain harmful constituents. Bitter almond comes from another species, Prunus amara, and does contain harmful constituents that shouldn’t be applied to skin.
See natural moisturizing factor (NMF)
References for this information: 
ISRN Toxicology, September 2013, ePublication
Complementary Therapies in Clinical Practice, February 2010, pages 10-12
Journal of Agricultural and Food Chemistry, June 2008, pages 4,096-4,10"
Aloe barbadensis,GOOD,Skin-Soothing,none
aloe barbadensis leaf juice extract,GOOD,Skin-Soothing,"May also be listed as aloe barbadensis leaf juice powder, aloe extract, or aloe juice."
aloe barbadensis leaf juice powder,GOOD,Plant Extracts,Aloe barabadensis leaf juice powder is the powder form of the aloe plant. It is obtained from dried leaves of the aloe plant and functions as a skin-conditioning agent.
aloe extract,GOOD,Skin-Soothing,none
aloe juice,GOOD,Skin-Soothing,none
aloe vera,GOOD,Skin-Soothing,"Aloe vera (also listed by its Latin name of aloe barbadenis) is a commonly used plant extract that has soothing properties, antioxidant qualities, and serves as a hydrating agent for skin due to its polysaccharide and sterol content. Aloe is a good ingredient, but its benefits tend to be over exaggerated in the cosmetics worlds and more research is needed in regards to its effectiveness for some of the more outlandish or miraculous-sounding claims.
In pure form straight from the leaves, aloe vera’s benefits for skin include its lack of occlusion and the refreshing sensation it provides (hence, why it’s in common “after sun” products).
Note: Some brands use aloe in place of water in their products, but aloe is actually 99.5% water.
References for this information:
Giornale Italiano Di Dermatologia, February 2009, pages 85-91
Indian Journal of Dematology, 2008, pages 163-166
Skin Research and Technology, November 2006, pages 241-246
Journal of Ethnopharmacology, December 1999, pages 3-37"
alpha bisabolol,BEST,Skin-Soothing,none
alpha glucan oligosaccharide,BEST,Emollients,Emollient used in cosmetics that also has water-binding properties.
alpha hydroxy acid,BEST,Exfoliant,none
alpha isomethyl ionone,POOR,Fragrance: Synthetic and Fragrant Plant Extracts,"Volatile fragrance and flavoring ingredient that must be listed on products that contain it due to its risk of causing a sensitized reaction at concentations as low as 0.001%. It’s an ingredient to avoid if you have sensitive skin, especially because it’s almost always combined with other volatile fragrance components such as linalool and eugenol.
See linalool , eugenol , fragrance
References for this information:
Analytical and Bioanalytical Chemistry, July 2010, issue 6, pages 2579-2591
Journal of Chromatography, April 2010, issue 16, pages 2599-2605"
