Ingredients,Rate,Category,Information
collagen amino acids,GOOD,Hydration,"Collagen amino acids are made from the hydrolysis (breaking down with water) of protein, resulting in a high amount of a single amino acid, hydroxyproline, which serves to increase skin’s moisture levels and smoothness.
References for this information:
Clinical, Cosmetic, and Investigational Dermatology, February 2013, pages 43-49
Amino Acids, June 2012, pages 2,481-2,489"
colloidal oatmeal,BEST,Skin-Soothing,"A form of oatmeal used in cosmetics and skincare products. It is produced by finely grinding oats, then boiling them. Research shows avenathramides, potent types of antioxidants found in oats (and colloidal oatmeal), can help soothe skin. A high concentration of beta-glucan and starches in colloidal oatmeal also mean it has water-binding properties and is an effective skin protectant. In fact, the United States Food & Drug Administration (FDA) categorizes colloidal oatmeal as a skin protectant, allowing it to be listed as an active ingredient on skincare products.
References for this information:
Food and Drug Administration. CFR – Code of Federal Regulations Title 21. [Internet] [Cited April 2016] Available from: http://www.accessdata.fda.gov/scripts/cdrh/cfdocs/cfcfr/cfrsearch.cfm?fr=347.50
Journal of Drugs in Dermatology, September 2010, issue 9, pages 1116-1120
Journal of Drugs in Dermatology, February 2007, issue 2, pages 167-170"
colloidal silver,POOR,Uncategorized,Refers to ground-up silver suspended in solution.
comfrey extract,POOR,Sensitizing,"Extract of a perennial herb that several studies have shown can have harmful properties when taken orally.
Topical application of comfrey has skin-soothing properties, but it is recommended only for short-term use and only then if you can be sure the amount of pyrrolizidine alkaloids is less than 100 micrograms per application—something that is impossible to determine without sophisticated testing equipment—making comfrey an ingredient to avoid. The alkaloid content means it has the potential to aggravate skin.
References for this information:
Chemical Research in Toxicology, November 2001, issue 11, pages 1546-1551"
Commiphora myrrha extract,POOR,Plant Extracts,none
coneflower,GOOD,Skin-Soothing,Another name for echinacea; has soothing properties.
Copaifera officinalis,POOR,Plant Extracts,none
Copernicia cerifera wax,GOOD,Plant Extracts,none
copper gluconate,GOOD,Antioxidants,"Also known simply as copper, this mineral is an important trace element for human nutrition. The body needs copper to absorb and use iron, and copper is also a component of the powerful antioxidant enzyme superoxide dismutase.
Copper gluconate is a potentially exciting anti-aging ingredient, but certainly not among the most well researched or proven when it comes to topical application."
copper lysinate/prolinate,GOOD,Uncategorized,An amino acid/mineral complex that limited yet potentially exciting research has shown has the potential to improve the look of multiple signs of aging.
copper PCA,GOOD,Uncategorized,A synthetic skin-conditioning agent composed of the copper salt of PCA (Pyrrolidone Carboxylic Acid).
copper peptides,GOOD,Antioxidants,"Copper peptides combine the element copper with three amino acids. Copper peptides occur naturally in the body, and is a growing body of research concerning how copper peptides may improve the appearance of multiple signs of aging, but this concerns synthetic, lab-engineered peptides.
Are copper peptides finally the anti-aging answer? No. Although there’s some convincing research demonstrating copper bound with peptides has skin-smoothing benefit, those studies were set up and paid for by companies selling the ingredient complex or selling products that contain it, typically marketed as GHK-copper.

What’s more, these studies rarely, if ever, compare the allegedly wonderful results of copper peptides other, more established ingredients."
copper sulfate,AVERAGE,Uncategorized,"Effective for soothing skin, but there is no research showing it has any impact when used in skincare products."
Corallina officinalis extract,GOOD,Antioxidants,none
coriander,GOOD,Plant Extracts,"Herb and spice plant, the source of a fragrant component; it can aggravate skin.
Newer research has shown that coriander leaf extract has restorative benefit, which is likely due to coriander leaf being a rich source of linolenic acid. It also appears coriander offers antioxidant benefit, at least when consumed orally. Last, components in coriander oil have skin-soothing benefits, but that doesn't mean its fragrance components aren't cause for concern.
References for this information:
Journal of Medicinal Food, ePublication, July 2014
Phytotherapy Research, March 2012, issue 3, pages 420-424
Journal of the German Society of Dermatology, October 2008, pages 847-851
Journal of Food Protection, July 2001, issue 7, pages 1019–1024"
cornflower,BEST,Skin-Soothing,"Can have skin-soothing properties.
References for this information:
(Source: Journal of Ethnopharmacology, December 1999, issues 1-3, pages 235–241"
cornmint,POOR,Plant Extracts,Also known as wild mint; it can aggravate skin.
corn oil,BEST,Plant Extracts,"Emollient oil with properties similar to those of other nonfragrant plant oils.
References for this information:
British Journal of Dermatology, June 1994, issue 6, pages 757–764"
cornstarch,GOOD,Plant Extracts,"Starch obtained from corn and sometimes used as an absorbent in cosmetics instead of or alongside talc. Generally, in powders corn starch lends a silky but dry feel and some find it is better at absorbing excess oil without looking cakey than pure talc-based powders. Cornstarch is also used as a thickening agent in skin-care products."
Cornus extract,GOOD,Skin-Soothing,none
Corylus americana,GOOD,Plant Extracts,none
Corylus avellana,GOOD,Plant Extracts,none
coumarin,GOOD,Antioxidants,"Organic compound found in plants and derived from the amino acid phenylalanine. It creates the fragrance in fresh-mowed hay. More than 300 coumarins have been identified from natural sources, especially green plants. However, simple coumarins are potent antioxidants.
References for this information:
Journal of Natural Products, September 2001, issue 9, pages 1238–1240
Chemistry and Physics of Lipids, December 1999, issues 1-2, pages 125–135
General Pharmacology, June 1996, issue 4, pages 713–722"
cranberry seed extract,BEST,Skin-Soothing,Extract of the cranberry fruit. Natural components known as proanthocyanidins are responsible for this extract’s antioxidant and skin-soothing properties.
cranberry seed oil,BEST,Antioxidants,"Extract derived from the seed of this red berry; the oil (which is not red) has potent antioxidant ability because it is a rich source of polyphenols as well as skin-restoring benefits.
References for this information:
Journal of Agricultural and Food Chemistry, November 2005, issue 22, pages 8485—8491"
Crataegus monogina extract,AVERAGE,Plant Extracts,none
creatine,BEST,Skin-Restoring,An amino acid found in the human body and most type of meat and fish. This ingredient serves as the precursor to adenosine triphosphate.
cucumber extract,GOOD,Antioxidants,"Non-sensitizing plant extract (also known by its Latin name of Cucumis sativus). Most types of cucumber are composed of 95% water, and the other constituents primarily include ascorbic acid (vitamin C), caffeic acid (an antioxidant), fatty acids, the mineral silica, plus other trace minerals. Due to its antioxidant activity, cucumber is a welcome addition to anti-aging products.
Cucumber contains fragrant components that are not sensitizing to skin (a rarity) so it can be used to enhance the natural scent of a cosmetic product without issue.
While this ingredient is often reported to be useful for improving the appearance of puffy eyes there is not adequate, reliable research to support this contention.
In case you’re wondering: The act of placing slightly chilled cucumber slices over the eye may help reduce puffiness, but that’s not because the cucumber has de-puffing properties. Rather, it’s the coolness of it that diminishes puffiness and constricts the skin, and cucumber slices just happen to fit the contours of the eye area.
References for this information:
International Journal of Toxicology, May 2014, pages 47-67
Archives of Dermatological Research, May 2011, pages 247-252
Natural Product Research, October 2010, pages 1537-1545"
Cucumis melo (melon) fruit extract,BEST,Antioxidants,"More commonly known as cantaloupe or honeydew melon, Cucumis melo (melon) is a fruit rich in vitamins A and C and a wide range of various antioxidant compounds.
References for this information:
Food Chemistry, March 2010, issue 2, pages 643-647
Journal of Ethnopharmacology, September 2004, issue 1, pages 67-75"
Cucumis sativus extract,GOOD,Antioxidants,none
Cucurbita pepo seed extract,BEST,Antioxidants,none
Cucurbitea peponis,BEST,Antioxidants,none
Curcuma longa root,BEST,Antioxidants,none
curcumin,BEST,Skin-Soothing,"Potent antioxidant and soothing spice that can be effective in replenishing skin.
References for this information:
Biochemical Pharmacology, February 2008, issue 4, pages 787-80"
Cyamopsis tetragonoloba,GOOD,Plant Extracts,none
cyanocobalamin,GOOD,Vitamins,none
cyclamen aldehyde,POOR,Fragrance: Synthetic and Fragrant Plant Extracts,Synthetic fragrant component in products; it can aggravate skin.
cyclohexasiloxane,GOOD,Emollients,"One of the numerous forms of synthetic silicone used in haircare and skincare products to improve texture, add shine (to hair) and impart emollience. "
cyclomethicone,GOOD,Emollients,Silicone with a drier finish than dimethicone.
cyclopentasiloxane,GOOD,Emollients,"Lightweight silicone with a silky, slippery feel that functions as a skin/hair conditioning agent.
Reference for this information:
International Journal of Toxicology, December 2011, pages 149-227."
cyclotetrasiloxane,GOOD,Emollients,none
Cymbopogon citrates,POOR,Plant Extracts,none
Cymbopogon martini,POOR,Antioxidants,none
cysteine,GOOD,Skin-Replenishing,none
cystine,GOOD,Skin-Replenishing,none
D&C,GOOD,Coloring Agents/Pigments,"According to the United States Food and Drug Administration (FDA), D&C indicates that a coloring agent has been approved as safe in drug and cosmetics products, but it does not apply to food."
D&C colors,GOOD,Coloring Agents/Pigments,General term for a wide group of color additives that are approved for use in drugs and cosmetics but not in foods (foods may only be colored with FD&C-approved dyes). Many red dyes fall into this category due to concern about oral consumption.
daisy flower extract,POOR,Plant Extracts,"There is no research showing this extract has any benefit for skin. Also known as tansy, it can cause severe sensitivity and is considered unsafe for topical application."
d-alpha-tocopherol,BEST,Antioxidants,Antioxidant that's considered the most effective form of vitamin E.
Daucus carota,POOR,Antioxidants,"Also known as wild carrot. It can have antioxidant properties, but applied topically it can cause sensitivity."
DEA oleth-10 phosphate,GOOD,Texture Enhancer,"Used as an emulsifying agent, which is a group of ingredients essential to most cosmetic formulations because they can keep unlike ingredients mixed together smoothly (a prime example is oil and water)."
decarboxy carnosine HCL,BEST,Skin-Soothing,none
decylene glycol,GOOD,Skin-Replenishing,A synthetic glycol that functions as a skin-conditioning agent. Glycols also give slip to products (for easier application) and can help enhance the penetration of other ingredients.
decyl glucoside,GOOD,Cleansing Agents,Sugar-derived ingredient used as a gentle detergent cleansing agent.
decyl oleate,GOOD,Emollients,A skin-conditioning agent derived from the esters of decyl alcohol and oleic acid.
dehydroacetic acid,GOOD,Preservatives,"A synthetic preservative used in amounts of 0.6% or less where it’s proven to be safe and effective. Dehydroacetic acid is characterized as a white to cream crystalline powder. Sometimes its salt form (known as sodium dehydroacetate) is used, as it is more soluble in certain types of cosmetic formulas. Dehydroacetic acid is most effective on fungi.
Reference for this information:
Journal of the American College of Toxicology, 1985, pages 123-159"
dehydroepiandrosterone,AVERAGE,Uncategorized,none
deionized/demineralized water,GOOD,Uncategorized,Filtered water used in cosmetics. All water used in cosmetic formulations goes through this process to remove components that could interfere with a product’s stability and performance.
denatured alcohol,POOR,Sensitizing,"Denatured alcohol is a drying type of alcohol that aggravates and weakens skin. Typically, if denatured alcohol is listed as the fifth ingredient or higher, it is of considerable risk for sensitizing skin.
References for this information:
BBA Biomembranes, May 2012, pages 1410-1419
Alcohol, April 2002, pages 131-202"
deoxyribonucleic acid,AVERAGE,Uncategorized,none
detergent cleansing agent,GOOD,Cleansing Agents,none
deuterium oxide,AVERAGE,Uncategorized,none
dextran,GOOD,Skin-Replenishing,Polysaccharide that has water-binding properties for skin.
dextrin,GOOD,Texture Enhancer,Carbohydrate that is classified as a polysaccharide. It is used as an adhesive when mixed with water. For skin it can have water-binding properties.
DHA,GOOD,Uncategorized,none
diatomaceous earth,AVERAGE,Scrub Agents,Light-colored porous rock composed of the skeletons of minute sea creatures called diatoms. Typically used as an abrasive material in scrub products.
diazolidinyl urea,AVERAGE,Preservatives,"Water-soluble preservative. This preservative is considered safe for use at concentrations up to 0.5%, although it’s usually present at lower concentrations because it’s typically part of a blend with other preservatives (such as parabens).
Diazolidinyl urea can be a formaldehyde-releasing preservative. Although that sounds scary, the amount of formaldehyde released is well below the recommended limits of exposure. Moreover, other ingredients (such as proteins) in a product cause the free formaldehyde to evaporate and become inactive before it could possibly harm skin.
See formaldehyde-releasing preservative
References for this information:
Steinberg, David C., Preservatives for Cosmetics, Third Edition, Allured Books, 2012, pages 67-68
Contact Dermatitis, August 2011, pages 81-91; and January 2006, pages 50-58
International Journal of Toxicology, March-April 1990, issue 2, pages 229-245"
dibutyl phthalate,AVERAGE,Uncategorized,"Also known as DBP, it is a common ingredient in nail polish and most synthetic fragrances sold today. It is used as a plasticizer, fragrance stabilizer, and is a key component in giving nail polish its unique properties. The most common mode of exposure, though, is through foods that come into contact with PVC (polyvinylchloride) plastic packaging. Phthalates are also found in countless other products, including building materials, insecticides, nutritional supplements, children’s toys, and automobiles (Source: International Journal of Andrology, February 2006, pages 181–185). In short, it is impossible to completely avoid exposure to phthalates.
Dibutyl phthalate (DBP) became controversial when The Centers for Disease Control and Prevention published the National Report on Human Exposure to Environmental Chemicals—Results for Mono-butyl phthalate [which is] (metabolized from dibutyl phthalate). The report noted that measurable levels of phthalate were found in the urine of the participants in the study. However, the CDC also stated that “Finding a measurable amount of one or more phthalate metabolites in urine does not mean that the level of one or more phthalates causes an adverse health effect. Whether phthalates at the levels of metabolites reported here are a cause for health concern is not yet known; more research is needed.""
Despite the negative association phthalate exposure has in animals, an analysis of multiple studies and epidemiologic research led to the conclusion that “...the risks are low, even lower than originally thought, and that there is no convincing evidence of adverse effects on humans. Since the scientific evidence strongly suggests that risks to humans are low, phthalate regulations that have been enacted are unlikely to lead to any marked improvement in public health.”
References for this information:
Food Additives and Contaminants, November 2010, pages 1608–1611,1616
Risk Analysis, August 2009, issue 8 pages 1170­-1181
Journal of Toxicology and Environmental Health, February 2009, pages 157­–174
Environmental Health Perspectives, December 2000, volume 108, issue 12"
dicaprylyl carbonate,GOOD,Emollients,"According to the Personal Care Product Council’s Ingredient Infobase, dicaprylyl carbonate functions as a skin-conditioning agent, emollient and solvent. It may be derived from synthetic or animal sources; Paula’s Choice Skincare uses the synthetic form.
Dicaprylyl carbonate is desirable for products such as facial moisturizers because it spreads easily and leaves a velvety feel on skin without seeming greasy or slick. It also helps enhance the absorption of other ingredients in a cosmetic formula."
dicetyl phosphate,GOOD,Cleansing Agents,A mix of portions from cetyl alcohol and phosphoric acid that functions as surfactant and emulsifier.
diethylhexyl carbonate,GOOD,Emollients,A synthetic oil-like ester that functions as a skin-conditioning agent and emollient. Also used in sunscreen formulas to help keep the active ingredients dispersed throughout the formula.  
diethylhexyl malate,GOOD,Emollients,Emollient and skin-conditioning agent derived from the solvent ethyl hexanediol.
diethylhexyl syringylidenemalonate,GOOD,Antioxidants,An ester that functions as an antioxidant and helps protect cosmetics products from chemical or physical deterioration induced by light.
diheptyl succinate,BEST,Texture Enhancer,"Diheptyl succinate is a lightweight, emollient texture enhancer that is sometimes used as a replacement for silicones in cosmetic products. 
 Reference for this information: 
http://www.cosmeticsandtoiletries.com/formulating/function/feelenhancer/169326356.html"
dihydrocholeth-30,GOOD,Cleansing Agents,"A synthetic ingredient that functions as an emulsifier and surfactant. It's also known as PEG-30 dihydrocholesteryl ester. This ingredient is most commonly used in cleansers, makeup removers, toners, and moisturizers."
dihydroxyacetone,GOOD,Uncategorized,"Ingredient that affects the color of skin and that is present in most self-tanners. Derived from sugar, it reacts with amino acids found in the top layers of skin to create a shade of brown; the effect takes place within two to six hours and it can build color depth with every reapplication. It has a long history of safe use when applied topically to skin, where it affects only the uppermost layers. Dihydroxyacetone doesn’t pose a health risk to skin.
References for this information:
Journal of the American Academy of Dermatology, May 2004, issue 5, pages 706-713"
diisopropyl adipate,GOOD,Texture Enhancer,"Used as a film-forming agent, emollient, and skin-conditioning agent."
diisopropyl dimer dilinoleate,GOOD,Emollients,A synthetic ester that functions as a skin-conditioning agent and emollient.
diisostearoyl trimethylolpropane siloxy silicate,GOOD,Silicones,Emollient in the silicone family.
diisostearyl dimer dilinoleate,GOOD,Emollients,A synthetic ester that functions as an emollient. May be animal-derived.
diisostearyl malate,GOOD,Emollients,Diisostearyl malate is an ester that functions as an emollient in cosmetics. It is created from malic acid and isostearyl alcohol. This ingredient is most commonly used in lipsticks and has been deemed safe for use by the Cosmetic Ingredient Review board.
dimer dilinoleyl dimer dilinoleate,GOOD,Emollients,A mixture of fatty acids and a fatty alcohol. This synthetic ingredient is most often used to give texture and form to lipstick and lip gloss. Some cosmetic companies use this ingredient in place of lanolin.
dimethicone,GOOD,Silicones,"A type of silicone, dimethicone is one of the most frequently used emollient ingredients in moisturizers due to its gentleness and effectiveness. Dimethicone is considered a synthetic ingredient, even though it’s derived from natural silicon.
Applied to skin, dimethicone forms a permeable barrier that works to prevent moisture loss and impart a wonderfully silky feel.
Dimethicome is considered safe as used in cosmetic products.
References for this information:
International Journal of Toxicology, May 2014, pages 65S-115S
The Journal of Clinical and Aesthetic Dermatology, May 2014, pages 36-44
Dermatologic Therapy, May-June 2012, pages 229-233
Clinics in Dermatology, May-June 2012, pages 345-348
Skin Research and Technology, May 2000, pages 77-80"
dimethicone/PEG-10/15 crosspolymer,GOOD,Silicones,A mixture of the silicone dimethicone with PEG-10 and PEG-15.
dimethicone/vinyl dimethicone crosspolymer,GOOD,Texture Enhancer,none
dimethicone copolyol,GOOD,Silicones,none
dimethicone crosspolymer,GOOD,Texture Enhancer,Silicone derivative used as a stabilizing and suspending agent or as a thickener.
dimethiconol,GOOD,Silicones,none
dimethyl capramide,GOOD,Uncategorized,Functions as a stabilizer and solvent in cosmetics.
dimethyl ether,POOR,Uncategorized,"Colorless gas used as a propellant in aerosol products. It is harmful if inhaled and can aggravate skin.
References for this information:
Handbook of Cosmetic and Personal Care Additives, Second Edition, volume 2, 2002, Synapse Information Resources, Inc."
dimethyl isosorbide,GOOD,Uncategorized,"Dimethyl isosorbide is a clear, slighlty oily-feeling liquid that functions as a solvent and may be plant-based or synthetic. It is also used to decrease the thickness of products, such as keeping a liquid in its fluid form rather than wllowing it to rever to a lotion (or, in cosmetics chemistry parlance, a thicker emulsion).
Another function of this ingredient is to allow controlled, sustained delivery of key ingredients such as antioxidants, so they can, in theory, provide stronger benefits.
References for this information:
International Journal of Pharmaceutics, October 2012, issue 1, pages 38-49
ChemSusChem, May 2010, issue 5, pages 566-570
Skin Pharmacology and Applied Physiology, issue 6, October 2008, pages 326-334"
dimethyl MEA,AVERAGE,Skin-Restoring,none
Dioscorea villosa extract,AVERAGE,Plant Extracts,none
dipentaerythrityl hexacaprylate/hexacaprate,GOOD,Texture Enhancer,"Mixture of fatty acids used as an emollient, emulsifier, and thickening agent."
dipotassium glycyrrhizate,BEST,Skin-Soothing,none
dipotassium glycyrrhizinate,BEST,Skin-Soothing,none
dipotassium phosphate,GOOD,Miscellaneous,"A synthetic salt that helps to adjust and maintain the pH of water-based and water soluble cosmetic formulas. Dipotassium phosphate is also used in foods as a buffering agent to improve food texture, where it has GRAS (generally recognized as safe) status.
References for this information:
https://www.accessdata.fda.gov/scripts/cdrh/cfdocs/cfcfr/CFRSearch.cfm?CFRPart=182"
di-PPG-3 myristyl ether adipate,GOOD,Texture Enhancer,Derivative of myristyl alcohol (a fatty alcohol) and adipic acid (a buffering and neutralizing ingredient). It is used as a skin-conditioning agent and solvent in cosmetics.
dipropylene glycol,GOOD,Texture Enhancer,Synthetic slip agent and texture enhancer.
disodium cocoamphodiacetate,GOOD,Cleansing Agents,Mild detergent cleansing agent derived from coconut; most often used in facial cleansers.
disodium cocoyl glutamate,GOOD,Cleansing Agents,A cleansing agent derived from coconut.
disodium diglyceryl phosphate,GOOD,Texture Enhancer,Used as an emollient and thickening agent in cosmetics.
disodium EDTA,GOOD,Uncategorized,"Short for disodium ethylenediaminetetraacetic acid. Used as a chelating agent in cosmetic products, meaning it prevents ingredients in a formula from binding with trace elements (mainly minerals) that can be present in water. Studies have found that EDTAs, including disodium EDTA, as used in cosmetic formulations are safe.
References for this information:
European Commission Directorate General for Health and Consumers. Cosmetic Ingredient Glossary; Substance: Disodium EDTA. [Internet]. 2015 [cited 2015 Sept]. Available from: http://ec.europa.eu/growth/tools-databases/cosing/index.cfm?fuseaction=search.details_v2&id=33604
International Journal of Toxicology, 2002, Supplement 2, pages 95-142"
disodium glyceryl phosphate,GOOD,Texture Enhancer,Used as an emollient and thickening agent in cosmetics.
disodium lauraminopropionate,GOOD,Cleansing Agents,A mild surfactant.
disodium lauriminodipropionate tocopheryl phosphates,GOOD,Uncategorized,"A complex mixture of esters formed from a blend of tocopherol phosphates with lauriminodipropionic acid. This blend is part natural, part synthetic and has multiple functions, including as a cleansing agent. Lauriminodipropionic acid is a propionic acid, a natural acid that is part of the degraded contents of sugar. It has mild preservative properties."
disodium rutinyl disulfate,GOOD,Antioxidants,A water-soluble derivative of the bioflavinoid rutin. Research shows rutin has both antioxidant and skin-soothing properties.
disteardimonium hectorite,GOOD,Uncategorized,"Used as a suspending agent, often with pigments."
