Ingredients,Rate,Category,Information
kiwi fruit extract,AVERAGE,Antioxidants,"As a food, kiwi has significant antioxidant properties that may even be greater than those of vitamin C. Whether that benefit translates into its use on skin has not been demonstrated. The acid component of the kiwi can be a skin sensitizer"
kojic acid,GOOD,Antioxidants,"By-product of the fermentation process of malting rice for use in the manufacture of sake (Japanese rice wine). In vitro and in vivo research and animal studies have shown that kojic acid is effective for brightening an uneven skin tone.
Kojic acid’s downside is that it’s an extremely unstable ingredient in cosmetic formulations. On exposure to air or sunlight, it turns brown and loses its efficacy. Many cosmetics companies use kojic dipalmitate as an alternative because it’s more stable in formulations. However, there’s no research showing that kojic dipalmitate is as effective as kojic acid, although it’s a good antioxidant.
References for this information: 
International Journal of Molecular Sciences, September 2009, pages 4,066-4,087
Journal of Cosmetic Science, March-April 2004, pages 139-148
Journal of Dermatological Science, May 2003, pages 193-201
The Journal of Pharmacy and Pharmacology, December 1994, pages 982-985"
kojic dipalmitate,GOOD,Antioxidants,"Mixture of kojic acid and palmitic acid that functions as a skin-softening agent and a fat-soluble antioxidant. Although it’s more stable than the similar-sounding kojic acid, there’s no research showing kojic dipalmitate is as effective as kojic acid."
kola nut,AVERAGE,Plant Extracts,"One of the major components of the kola nut is caffeine, which in high amounts can be a skin sensitizer."
kudzu root,BEST,Antioxidants,"Source of isoflavone, genistein, and daidzein. It can be a potent antioxidant.
References for this information:
Phytochemistry, June 2002, pages 205–211
Journal of Alternative Complementary Medicine, 1997, pages 7–12 "
kukui nut oil,BEST,Plant Extracts,"Also known as candlenut or candleberry oil, this non-fragrant plant oil is found throughout India and Indonesia. Research has shown it has skin-soothing benefits."
lactic acid,BEST,Exfoliant,"Alpha hydroxy acid (AHA) extracted from milk, although most forms used in cosmetics are synthetic because that form is easier to formulate with and stabilize.
In a pH-correct formula (generally a product would have a pH between 3 and 4) and in concentrations between 5 and 12%, lactic acid exfoliates on the surface of skin by breaking down the material that holds dead skin together, allowing it to shed naturally as it once did. Lactic acid may cause sensitivity, although this isn’t common and can be minimized, if not eliminated, if the formulation contains soothing ingredients.
Lactic acid also has hydrating properties and, like glycolic acid (another AHA), helps brighten an uneven skin tone. 
Reference for this information:
Journal der Deutschen Dermatologischen Gesellschaft, 2012, issue 7, pages 488-491
Clinical, Cosmetic, and Investigational Dermatology, November 2010, pages 135-142
Journal of the American Academy of Dermatology, September 1996 pages 388-391
Archives of Dermatology, June 1996, pages 631-636"
lactobionate,GOOD,Skin-Replenishing,Polysaccharide that has water-binding properties for skin.
lactobionic acid,BEST,Exfoliant,none
lactoperoxidase,BEST,Miscellaneous,"Enzyme derived from milk that has unique properties to restore skin's surface flora as well as in the pore.
Reference for this information:
Journal of Applied Microbiology, May 2006, pages 1034–1042"
lady's mantle extract,POOR,Plant Extracts,none
lady's thistle (milk thistle) extract,BEST,Antioxidants,"Also known as milk thistle, this extract has a great deal of research showing it has many applications, owing to the skin-soothing, restorative, and antioxidant effects of its main chemical seed constituent, silymarin.
References for this information:
International Journal of Oncology, May 2010, pages 1,053–1,060
Clinics in Dermatology, September-October 2009, pages 479–484
Photochemistry and Photobiology, March-April 2008, pages 266–271"
Lagerstroemia indica extract,AVERAGE,Plant Extracts,No research shows this plant as having any benefit for skin.
Laminaria digitata,GOOD,Antioxidants,none
Laminaria longicruris,GOOD,Antioxidants,none
Laminaria ochroleuca extract,GOOD,Skin-Soothing,"The Latin name for a species of kelp, also known as brown seaweed. Applied topically, it helps soothe and, like all forms of seaweed, has some amount of moisture-binding properties.
References for this information:
Journal of the European Academy of Dermatology and Venereology, September 2007, pages 1,124-1,125
Biomedical Chromotography, April 2004, pages 183-190"
Laminaria sacharrina,GOOD,Antioxidants,none
Lamium album flower extract,BEST,Skin-Soothing,"A species of the nettle plant that is used topically as an skin-soothing owing to its saponin content. This plant also functions as an antioxidant.
Reference for this information:
Fitoterapia, July 2006, pages 346–353"
lanolin,GOOD,Emollients,"Emollient, very thick substance derived from sheep. Lanolin has long been burdened with a reputation for being a sensitizing agent, which has always been a disappointment to formulators because lanolin is such an effective moisturizing ingredient. 
A study in the British Journal of Dermatology concluded “that lanolin sensitization has remained at a relatively low and constant rate even in a high-risk population.” Based on a review of 24,449 patients who were tested with varying forms of lanolin, it turned out that “The mean annual rate of sensitivity was 1.7%”—and it was lower than that for a 50% concentration of lanolin. The amounts of lanolin used in products like facial and body moisturizers are much less than this, so the risk, if any, is negligible. 
Lanolin is a very good ingredient for someone with dry skin, though it can be a problem for someone with oily or breakout-prone skin. Also, as an animal-derived ingredient, lanolin is sometimes viewed as less favorable in comparison to synthetic or plant-derived alternatives. 
Reference for this information:
Dermatitis, March-April 2008, pages 63-72
British Journal of Dermatology, 2001, issue 1, 28-31"
lanolin alcohol,GOOD,Emollients,"Emollient derived from lanolin. Despite the “alcohol” in the name, this ingredient is not a skin sensitizer. Instead, it’s a fatty alcohol that can greatly benefit dry skin because it helps defend against moisture loss and maintain a supple feel on skin."
lappa extract,GOOD,Skin-Soothing,none
Larrea divaricata extract,GOOD,Antioxidants,none
Larrea tridentata,GOOD,Antioxidants,none
L-ascorbic acid,BEST,Skin-Soothing,"Form of vitamin C that is a potent antioxidant and skin-soothing agent and can improve the appearance of signs of aging and help brighten an uneven skin tone. L-ascorbic acid is often labelled as the INCI complaint “ascorbic acid” on ingredient lists, but there is no difference between the two—they refer to the same ingredient. 
References for this information:
Indian Dermatology Online Journal, 2013, issue 2, pages 143-146
Dermatological Surgery, 2005, issue 7 part 2, pages 814-818
Dermatological Surgery, 2001, issue 2, pages 137-142"
lauramphocarboxyglycinate,GOOD,Cleansing Agents,Mild cleansing agent.
laurdimonium hydroxypropyl hydrolyzed soy protein,GOOD,Miscellaneous,none
laurdimonium hydroxypropyl hydrolyzed wheat protein,GOOD,Miscellaneous,none
laureth-23,GOOD,Thickeners/Emulsifiers,"Derived from lauryl alcohol and used either as a cleansing agent or texture enhancer (or, in many cases, as both)."
laureth-4,GOOD,Thickeners/Emulsifiers,"Derived from lauryl alcohol and used either as a cleansing agent or texture enhancer (or, in many cases, as both)."
laureth-7,GOOD,Thickeners/Emulsifiers,"Form of lauryl alcohol (a non-sensitizing fatty alcohol derived from coconut oil) that can function as a cleansing agent and texture enhancer. Despite information found on the Internet, there’s no substantiated evidence that this ingredient is problematic for oily skin."
laureths,GOOD,Cleansing Agents,Substances that in various combinations create a wide range of mild cleansing agents.
lauric acid,BEST,Skin-Replenishing,"One of several fatty acids found in coconut oil and other natural fats, lauric acid has multiple uses in cosmetics. Its natural bay leaf-like scent can be used in high amounts to add fragrance to products, but it’s more often used as a base for cleansing agents, and, increasingly, for its skin-soothing actions. Some studies have shown it can also have antimicrobial activity.
Reference for this information:
Biomaterials, October 2009, pages 6035-6040"
lauroyl lysine,GOOD,Miscellaneous,"Amino acid derivative that functions as a skin-softening and hair-conditioning agent. It also contributes to a product’s texture by helping to gel the solvents, while also remaining stable under high heat conditions.
Reference for this information:
Organic & Biomolecular Chemistry, 2003, issue 22, pages 4125-4134"
Laurus nobilis,POOR,Antioxidants,none
lauryl alcohol,GOOD,Cleansing Agents,none
lauryl glucoside,GOOD,Cleansing Agents,none
lauryl lactate,GOOD,Fragrance: Synthetic and Fragrant Plant Extracts,Mixture of lauryl alcohol and lactic acid that functions as a skin-softening agent and emollient; also used to impart fragrance.
lauryl laurate,BEST,Emollients,"An ester of lauryl alcohol and lauric acid, lauryl laurate is an emollient ingredient that can help bioactive ingredients better integrate with skin’s surface. It is considered safe as used in cosmetics.
 
References for this information: 
Drug Delivery and Translational Research, April 2017, pages 333-435
Chemical and Pharmaceutical Bulletin, Volume 64, No. 11, 2016, pages 1,597-1,606
http://www.cir-safety.org/sites/default/files/alkyle032013rep.pdf"
lauryl PEG-9 polydimethylsiloxyethyl dimethicone,GOOD,Emulsifiers,"A silicone polymer that has multiple functions in cosmetic products, including skin/hair softening and texture enhancer."
lavandin oil,POOR,Plant Extracts,"Essential oil of the hybrid lavender plant Lavandula hybrida and used in cosmetics as a fragrance ingredient. Its sensitizer potential for skin is similar to that of lavender oil and camphor. Lavandin yields four times more oil per volume of plants than true lavender, but it is of inferior quality and has a distinct camphor scent. It is not used in perfumery, but instead to scent soaps, air fresheners, and similar items."
Lavandula angustifolia,POOR,Plant Extracts,none
Lavandula officinalis,POOR,Plant Extracts,none
lavender extract and oil,POOR,Plant Extracts,"Widely used plant that’s a member of the mint family. May be listed by its Latin names Lavandula angustifolia or Lavandula officinalis. Primarily a fragrance ingredient, it may have beneficial properties for skin but is also a potential sensitizer due to its fragrance components. The oil form is more likely to aggravate skin than the extract form, especially if you can detect lavender’s distinctive scent.
In-vitro research indicates that components of lavender oil, specifically linalool and linalyl acetate, can have damaging effects on skin in as low a concentration as 0.25%. When exposed to air, these components oxidize, meaning their potential for causing a reaction increases.
If you’re wondering why lavender oil doesn’t appear to be problematic for some people, it’s because research has demonstrated that you don’t always need to immediately see or feel the sensitizing effects for your skin to suffer damage.
References for this information:
British Journal of Dermatology, August 2014, pages 292-297
Skin Pharmacology and Physiology, May 2008, pages 191-202
Contact Dermatitis, April 2008, pages 143-150 and January 2008, pages 9-14
Cell Proliferation, June 2004, pages 221-229
Journal of the Society of Cosmetic Chemists, January-February 1992, pages 49-54"
L-cysteine,GOOD,Antioxidants,none
lecithin,BEST,Emollients,"Phospholipid found in egg yolks and plants. Widely used in cosmetics as an emollient and water-binding agent. Lecithin also has skin-restoring ability.
Reference for this information:
International Journal of Toxicology, 2001, volume 20, issue S1, pages 21-45"
lemon,POOR,Plant Extracts,"Citrus fruit that’s a potent skin sensitizer.The juice from lemon is often touted as being a natural option for brightening skin. The truth is that lemon juice is highly acidic (has a very low pH of 2) and exceedingly sensitizing to skin. Lemon juice applied to skin can cause photosensitivty on exposure to sunlight, which is due to a volatile fragrance chemical known as limonene, which is abundant in lemon juice. Lemon, whether in juice or oil form, is a must to avoid in cosmetics. 
Reference for this information:
Journal of American Academy of Dermatology, 2002, issue 5, pages 709-714"
lemon balm,POOR,Plant Extracts,none
lemongrass extract,POOR,Plant Extracts,"Extract that can have beneficial properties, but it also may be a skin sensitizer.
Reference for this information:
 Journal of Applied Microbiology, 2000, volume 88, pages 308–316 "
lemongrass oil,POOR,Plant Extracts,"Also known as Oil of Verbena. As a volatile fragrant oil, it contains compounds (including limonene and citral) that can cause sensitivity when applied to skin.
Reference for this information:
Phytomedicine, 2002, issue 3, 259-262"
lemon juice,POOR,Antioxidants,"The juice from the citrus fruit lemon, often touted in the world of skin care as being a natural option for brightening skin. The truth is that lemon juice is highly acidic, with a very low pH that's exceedingly sensitizing to skin. Lemon juice has a pH of 2, and comparing an ingredient with that pH to just one number up (that being pH 3) is like the difference between a minor tremor in the ground and a catastrophic earthquake.
Lemon juice applied to skin can cause photosensitivity, which is due to a volatile fragrance chemical known as limonene, which is abundant in lemon juice.
Bottom line: There's no research showing that lemon juice has a positive effect on brightening an uneven skin tone, yet it's clear this ingredient is a potent skin sensitizer. Given its antioxidant content, lemon juice has its benefits, but far better to consume it orally than apply it topically."
lemon oil,POOR,Plant Extracts,"Commonly used citrus oil that can be a skin sensitizer, especially on abraded skin. Lemon oil has limited research proving any benefits for skin. As with many fragrant oils, lemon oil has antioxidant components that can be beneficial, but there’s no valid reason to tolerate the bad to get the good.
Lemon oil contains numerous fragrance chemicals that can cause a reaction when on skin that’s subsequently exposed to sunlight. Examples of the fragrance chemicals in lemon oil include limonene, bergapten, and oxypeucedanin. Although it smells great, fragrance is not skincare! The major fragrance chemical in lemon oil is limonene.
References for this information:
Toxicology In Vitro, 2010, issue 8, 2084-2089
Acta Dermato Venereological, 2007, issue 4, pages 312-316
Archives of Dermatological Research, 1985, issue 1, pages 31-36"
lentil fruit extract,GOOD,Antioxidants,"Extract from the plant Lens esculenta that functions as a skin-softening agent and likely has antioxidant benefit, too."
Lentinus edodes extract,AVERAGE,Plant Extracts,"Extract from the shiitake mushroom that may have beneficial properties, although it could be a potential skin sensitizer."
Leontopodium alpinum extract,BEST,Skin-Soothing,Plant extract whose constituents are capable of provding antioxidant and skin-soothing benefit for skin.
Leptospermum scoparium oil,GOOD,Plant Extracts,none
leucine,GOOD,Skin-Replenishing,Amino acid.
Levisticum officinale root extract,POOR,Plant Extracts,none
licorice extract,BEST,Skin-Soothing,"Plant extract that has skin-soothing properties. In addition, licorice root may be effective in improving the look of an uneven skin tone. 
One of its components, known as glabridin, is a potent antioxidant and skin-soothing ingredient, which is why licorice often shows up in products meant for sensitive, reddened skin.
References for this information:
Fitoterapia, October 2013, pages 160-184
Journal of Clinical and Aesthetic Dermatology, July 2010, pages 20-31
International Journal of Molecular Science, 2009, issue 9, 4066-4087
Natural Product Research, December 2007, pages 1,234-1,241"
licorice root,BEST,Skin-Soothing,none
Lilium candidum bulb extract,AVERAGE,Plant Extracts,Extract derived from the white lily bulb. There is no research showing this has any benefit for skin.
lime oil and extract,POOR,Plant Extracts,"Citrus fruit whose volatile compounds are skin sensitizers and photosensitizers. Lime oil is a known fragrance sensitizer that contains the fragrance chemicals bergapten and limonene, both of which can cause what’s known as a photosenstive reaction when applied to skin. A phototoxic reaction can result in a patchy, uneven appearance to skin. Although lime extract and oil may have some antioxidant activity, their sensitizer potential outweighs any benefit.
References Cited:
Toxicology In Vitro, 2010, issue 8, pages 2084-2089
Acta Derm-Venereologica, 2007, issue 4, pages 312-316
Food and Chemical Toxicology, 1993, issue 5, pagesa 331-335
Archives of Dermatological Research, 1985, issue 1, pages 31-36"
Limnanthes alba,GOOD,Plant Extracts,Plant commonly known as meadowfoam; its seed oil is a non-volatile plant oil used as a skin-softening agent.
Limnanthes alba seed oil,GOOD,Plant Extracts,none
limonene,POOR,Fragrance: Synthetic and Fragrant Plant Extracts,"Chemical constituent of many natural fragrant ingredients, notably citrus oils such as lemon (d-limonene) and pine trees or species of the mint family (l-limonene). 
Topically, limonene can cause sensitivity and is best avoided. Also, because of its penetration-enhancing effects on skin, it’s particularly important to avoid products that contain limonene plus other skin sensitizers like denatured alcohol.
Like most volatile fragrance components, limonene also has strong antioxidant benefits and has also been shown to calm skin; however, when exposed to air these highly volatile antioxidant compounds oxidize and become capable of sensitizing skin.
Reference for this information:
Food and Chemical Toxicology, July 2015, pages 160-170
British Journal of Dermatology, August 2014, pages 292-297
Anti-inflammatory and Anti-allergy Agents in Medicinal Chemistry, March 2014, pages 29-35
Journal of Toxicology and Environmental Health, 2013, issue 1, pages 17-38
Contact Dermatitis, January 2009, pages 32-40"
linalool,POOR,Fragrance: Synthetic and Fragrant Plant Extracts,"Fragrant component of lavender and coriander that can be a potent skin sensitizer.
References for this information:
Contact Dermatitis, November 2016 (epublication: http://onlinelibrary.wiley.com/doi/10.1111/cod.12714/abstract)
Contact Dermatitis, January 2010, issue 1, pages 32-41"
linden flower extract,BEST,Antioxidants,Major active constituents in linden are flavonoids and glycosides. Flavonoids are potent antioxidants and glycosides are monosaccharides that have water-binding properties.
linoleic acid,BEST,Skin-Soothing,"Unsaturated omega-6 fatty acid found in corn, safflower, and sunflower oils and used as an emollient and thickening agent in cosmetics. There is some research showing it to be effective as a skin restorative, an antioxidant and as a skin-soothing agent.
Reference for this information:
Dermatology Research and Practice,  2012, pages 9231-9234
Archives of Dermatological Research, 1998, issue 7, pages 375-381
Clinical and Experimental Dermatology, 1998, issue 2, pages 56-58"
linolenic acid,BEST,Skin-Restoring,"Naturally occurring, colorless polyunsaturated fatty acid liquid that functions as a skin-conditioning agent and skin-restorative ingredient. Also known as alpha-linolenic acid, this ingredient is a plant-based omega-3 fatty acid that occurs in vegetable oil and flax seed oil as well as canola and soy oils. Walnuts are a top dietary source of this fatty acid. Linolenic acid has research showing topical application helps improve many skin concerns."
linseed oil,BEST,Plant Extracts,Non-volatile plant oil. Linoleic acid is a component of linseed oil. 
Linum usitatissimum extract,BEST,Plant Extracts,none
lipid,BEST,Thickeners/Emulsifiers,"Wide range of ingredients found in plants, animals, and human skin. In skincare products, these are emollients and thickening agents."
liposomes,GOOD,Miscellaneous,"Delivery system (not an ingredient) capable of holding other ingredients and releasing them after the liposome is absorbed into the skin. Liposomes are microscopic lipid (fat) sacs that are widely used as a way to deliver other ingredients into skin.
Reference for this information:
Journal of Pharmaceutical Sciences, March 2002, pages 615–622"
lithium magnesium sodium silicate,GOOD,Thickeners/Emulsifiers,"Synthetic silica-based clay composed of lithium, sodium, and magnesium. Used as a thickening agent and an absorbent."
Lithospermum erythrorhizon,BEST,Skin-Soothing,"Also known as gromwell, the root of this plant is believed to have antioxidant and skin-soothing activity.
References for this information:
Archives of Dermatological Research, July 2008, pages 317-323
Biological and Pharmaceutical Bulletin, May 2007, pages 928-934"
Litsea cubeba,POOR,Plant Extracts,none
locust bean,GOOD,Plant Extracts,none
Lonicera caprifolium flower extract,BEST,Skin-Soothing,none
Lonicera japonica,BEST,Skin-Soothing,Honeysuckle extract. A plant with soothing properties for skin.
Lonicera japonica flower extract,BEST,Skin-Soothing,none
loquat extract,BEST,Antioxidants,"Extract derived from a subtropical flower that has antioxidant properties similar to those of green tea.
References for this information:
Journal of Agricultural Food Chemistry, April 2002, pages 2400–2403
Phytochemistry, February 2002, pages 315–323"
lotus seed extract,BEST,Skin-Soothing,"Extract that can have skin-soothing and antioxidant properties.
References for this information:
Journal of Plant Physiology, May 2001, pages 39–46
Planta Medica, August 1997, pages 367–369"
lovage root extract,POOR,Plant Extracts,Used as a fragrance.
lupine,GOOD,Antioxidants,"Legume that is a source of isoflavones, a form of plant-derived ingredient that has antioxidant properties.
References for this information:
Phytochemistry, January 2001, pages 77–85
Bioscience, Biotechnology, and Biochemistry, June 2000, pages 1118–1125"
lupine oil,AVERAGE,Antioxidants,"Extract of Lupinus albus, a legume; it has emollient and antioxidant properties, though it may also have significant skin-sensitizing potential."
Lupinus albus extract,GOOD,Antioxidants,Species of legume.
lutein,BEST,Antioxidants,"Carotenoid that has antioxidant properties.
Reference for this information:
Photochemistry and Photobiology, May 2002, pages 503–596"
Lycium barbarum fruit extract,GOOD,Antioxidants,"The extract of the fruit commonly known as goji, goji berry, or wolfberry. This fruit extract is an antioxidant and also works as a skin-softening agent.
Reference for this information:
International Journal of Molecular Medicine, August 2007, pages 261–268"
lycopene,BEST,Antioxidants,"Carotenoid pigment that has antioxidant properties (Source: Photochemistry and Photobiology, May 2002, pages 503–596)."
lye,POOR,Cleansing Agents,none
lysine,GOOD,Antioxidants,Amino acid.
macadamia nut oil,GOOD,Plant Extracts,Used in cosmetics as an emollient for dry skin.
madecassoside,BEST,Antioxidants,"One of four principal bioactive compounds in the plant extract Centella asiatica. One double-blind study has shown even small amounts of this compound (0.1% in one case) combined with vitamin C have antioxidant benefit when applied to skin, and serve as an antioxidant in its own right. Studies also show it can it is non-sensitizing and can help revitalize skin’s surface.
References for this information: 
Acta Pharmaceutica, June 2016, pages 233-244
Journal of Biochemical and Molecular Toxicology, October 2012, pages 399-406
Biotechnology Letters, June 2008, ePublication
Planta Medica, June 2008, pages 809-815
Experimental Dermatology, May 2008, ePublication"
magnesium,GOOD,Absorbent,Earth mineral that has strong absorbent properties.
magnesium aluminum silicate,GOOD,Thickeners/Emulsifiers,"Powdery, dry-feeling, white solid that is used as a thickening agent and powder in cosmetics."
magnesium ascorbyl palmitate,GOOD,Antioxidants,"Fatty acid–based derivative of vitamin C that can be an effective antioxidant. Research shows this form of vitamin C is less stable than others such as magnesium ascorbyl phosphate, which is why we don’t rate it as highly as other forms of vitamin C.
Reference for this information:
International Journal of Cosmetic Science, 2008, issue 6, pages 453-458"
magnesium ascorbyl phosphate,BEST,Antioxidants,"Form of vitamin C that is considered stable and is an effective antioxidant for skin. This form of vitamin C is also known to increase skin’s hydration levels as well as being effective for calming factors in skin that can lead to excess oil and signs of sensitization.
Like most forms of vitamin C, magnesium ascorbyl phosphate (in amounts of 5% or greater) has been shown to improve the look of an uneven skin tone.
References for this information:
Annals of Dermatology, August 2015, pages 376-382
Indian Dermatology Online Journal, 2013, issue 2, pages 143-146
Skin Research and Technology, 2008, issue 3, pages 376-380
International Journal of Cosmetic Science, June 2000, pages 169-179"
magnesium carbonate,GOOD,Absorbent,"Inorganic mineral salt used as an absorbent, opacifying agent, coloring agent, or to adjust the pH of cosmetic products."
