Ingredients,Rate,Category,Information
propyl gallate,BEST,Antioxidants,"An ester of gallic acid that is an antioxidant, and helps protect fats and oils used in cosmetics products from becoming rancid. It has been ruled safe as used in cosmetics products.
References for this information:
International Journal of Toxicology, Supplement 3, 2007, pages 89-118"
propylparaben,GOOD,Preservatives,"Parabens are a group of controversial preservatives that include butylparaben, isobutylparaben, propylparaben, methylparaben, and ethylparaben. All of these were at one time the most widely used group of preservatives used in cosmetics. Parabens were so popular because of their gentle, non-sensitizing, and highly effective profile in comparison to other preservatives but also because they were derived naturally from plants, a rare phenomenon for a preservative. Parabens are found in plants in the form of p-hydroxybenzoic acid (PHBA), a chemical that breaks down to become parabens for a plants own protection.
Over the past 10 years parabens have become criticized and condemned for use in cosmetics due to their alleged relation to health concerns affecting women and men. The research about parabens is conflicting and polarizing. Some research indicates they are safe as used in cosmetics and are preferred over other preservatives to keep a formula stable. These studies also showed parabens did not have any effect when compared to natural hormones in the body.
However, other research has concluded they are indeed problematic: Some studies determined a 100% concentration of parabens caused skin samples (meaning not intact skin on a person) to break down. However, these studies don’t apply to the tiny amount (1% or less) of parabens typically used in cosmetics. In low amounts, parabens were not shown to harm skin; in fact, they offer a benefit due to their ability to thwart the growth of mold, fungi, and harmful pathogens.
Other studies casting parabens in a negative light were based on force-feeding them to rats, a practice that is not only cruel but unrelated to what happens when parabens are applied to skin. There are studies indicating absorption of parabens through skin associated with application of skincare products, but those studies did not take into consideration that parabens are still used as food-grade preservatives or found naturally in plants and that could have been the source not the cosmetics. We also looked at studies showing other questionable effects but those were done in vitro meaning in a petri dish or, again, animal studies in species whose biologic makeup does not closely relate to people.
We appreciate the concern about parabens and understand if people choose to avoid them. At Paula’s Choice Skincare we use parabens in a very limited number of products, but that decision is based on other reasons than the scare tactics rampant on the internet. For transparency, we list all ingredients on individual product pages and packaging and our Client Services team is always happy to help.
References for this information:
Journal of Exposure Science and Environmental Epidemiology, May 2017, 320-325
Annual Review of Food Science Technology, February 2017, pages 371-390
Journal of Applied Toxicology, April 2017, ePublication
Environmental Science and Technology, April 2017, page 4009-4017
Dermatitis, November-December 2015, pages 254-259
Toxicology Letters, December 2013, pages 295-305
Skin Therapy Letter, July-August 2013, pages 5-7
Journal of Agricultural Food Chemistry, June 2008, pages 4631-4636
International Journal of Toxicology, April 2008, pages 1-82
http://www.cosmeticsinfo.org/paraben-information"
Prunella vulgaris,AVERAGE,Skin-Soothing,none
Prunus americana,GOOD,Antioxidants,none
Prunus amygdalus dulcis,GOOD,Plant Extracts,none
Prunus armeniaca,GOOD,Plant Extracts,none
Prunus domestica seed extract,GOOD,Antioxidants,none
Prunus domestica seed oil,BEST,Antioxidants,"Non-fragrant plant oil, more commonly known as plum (and, when dried, prune) that is a rich source of several potent antioxidants.The oil form of this plant ingredient is likely more potent in terms of its antioxidant potential than isolated extracts. As such, this plant oil packs extra benefits for dry skin.
References for this information:
Biofactors, Volume 21, 2004, pages 309–313"
Prunus dulcis,GOOD,Emollients,none
Pseudopterogorgia elisabethae,BEST,Skin-Soothing,none
Psidium guajava fruit extract,BEST,Antioxidants,"More commonly known as guava, Psidum guajava fruit extract is a rich source of bioactive antioxidants, including gallic acid, catechin, chlorogenic acid, rutin, quercetin, tocopherol, beta-carotene and lycopene.
The leaf extract is also a good source of beneficial compounds for healthy skin.
Topical application of guava fruit can deliver these valuable antioxidants to skin, assuming the product in question is packaged to keep these light- and air-sensitive compounds stable during use (meaning no jar packaging).
References for this information:
Journal of Separation Science, October 2017, pages 3,817-3,829
EXCLI Journal, September 2015, pages 1,020-1,030
Physiology and Molecular Biology of Plants, October 2009, pages 327-334"
Pueraria lobata,BEST,Antioxidants,none
pullulan,GOOD,Antioxidants,"Glucan gum produced by black yeast that contains polysaccharides, which makes it a good water-binding agent, thickening agent, and antioxidant."
pumpkin,BEST,Antioxidants,"Plant whose seeds are a rich source of fatty acids and several antioxidant components, including carotene, lutein, and various cartenoid pigments. Pumpkin oil is a rich source of the skin-restoring ingredient linoleic acid and antioxidant vitamin E. Pumpkin does not contain fragrance chemicals that are sensitizing to skin, and as such can be considered a beneficial plant ingredient. Enzymes naturally present in pumpkin are often claimed to be alternative exfoliant/peel ingredients for skin. There is no substantiated research supporting the efficacy of exfoliating skin with pumpkin enzymes. In all likelihood, the enzymes do not remain active or stable once they are added to a cosmetic product."
pumpkin seed extract,BEST,Antioxidants,"Type of squash that is a very good source of antioxidant cartenoids and vitamin E. Pumpkin seed extract and pumpkin seed oil are also a great source of essential fatty acids (including linoleic acid) and zinc. It's an excellent non-fragrant plant extract to see in cosmetics.
References for this information:
Journal of Food Science, June 2012, issue 6, pages C653-657
Natural Product Research, September 2011, pages 1524-1539"
Punica granatum extract,BEST,Antioxidants,none
purified water,GOOD,Uncategorized,none
PVM/MA decadiene crosspolymer,GOOD,Texture Enhancer,Synthetic polymer used as a film-forming and thickening agent.
PVP,GOOD,Texture Enhancer,none
PVP/dimethylaminoethylmethacrylate,GOOD,Texture Enhancer,Polymer formed from PVP (polyvinylpyrrolidone) and the film-forming agent dimethylaminomethacrylate.
PVP copolymer,GOOD,Texture Enhancer,none
pycnogenol,GOOD,Antioxidants,"Antioxidant derived from the bark of the French Maritime pine tree. The term pycnogenol was previously used generically, but is now a U.S.-registered trademark. Only one company (Horphag Research, Ltd.) has access to this ingredient, and it is patent-protected.
There is a great deal of research on pycnogenol. However, most of the research dates back to 1990 and earlier. Prior to and even after pycnogenol was trademarked, it was used freely as a generic term for procyanidins. Procyanidins (also known as proanthocyanidins) are pigments belonging to the flavonoid family of ingredients. In addition to being derived from pine bark, procyanidins occur naturally in grape seeds (so red wine is a good source), peanut skins, unripe strawberries, apples, and cocoa beans.
There are studies supporting the notion that pycnogenol is a potent antioxidant."
pyridoxine hydrochloride (HCL),GOOD,Antioxidants,Scientific name for vitamin B6; may have antioxidant benefits for skin when applied topically.
Pyrus cydonia,POOR,Plant Extracts,none
Pyrus malus (apple) fruit extract,GOOD,Skin-Restoring,Species of apple; the pectin derived from it is used as a thickener in cosmetics.
quaternium-15,AVERAGE,Preservatives,"Formaldehyde-releasing preservative used in cosmetics. It can aggravate skin, as can all preservatives, although quaternium-15’s ability to do so is very low if the amount in a product is less than 0.2%.
References for this information:
International Journal of Toxicology, May 2010, supplement 3, pages 98S-114S"
quaternium-18 hectorite,GOOD,Texture Enhancer,Used as a suspending agent and also has emulsifying properties.
quaternium ammonium compounds,GOOD,Uncategorized,"A wide range of ingredients, called “quats” for short, that share a unique molecular structure that makes them strongly attracted to hair. When one end of the quat grabs the hair, the other end sticks out, providing a handle for another quat molecule to grab onto. This linking creates a lineup on the hair that resembles a temporarily smooth surface, allowing combs and brushes to more easily glide through hair. Found primarily in shampoos, rinse-off and leave-in conditioners, and any product that claims to detangle the hair, these less-than-poetic-sounding ingredients are essential for having manageable hair. Typical quats on an ingredient list include guar hydroxypropyltrimonium chloride, dicetyldimonium chloride, dihydrogenated tallow benzylmonium chloride, behentrimonium chloride, behenalkonium betaine, benzalkonium chloride, quaternium 18, stearalkonium chloride, cetrimonium chloride, and many more."
quercetin,BEST,Antioxidants,"Bioflavonoid ingredient from plants. Quercetin occurs naturally in red wine, tea, onions, kale, tomatoes, berries, and many other fruits and vegetables, with the highest concentrations found in the leaves and skins. It functions as an antioxidant, skin-soothing agent, and restorative ingredient. Quercetin is present in some herbal ingredients, too, including St. John’s wort and Ginkgo biloba.
In terms of skincare, research has shown that a lipid-based delivery system is optimal for quercetin to exert antioxidant benefits. Even more exciting, this type of formula provides an initial burst of quercetin followed by sustained release over a 24-hour period. When quercetin is mixed with silicone and lipids, the intake is greater, as confirmed by testing on human skin.
References for this information:
International Journal of Pharmacology, January 2013, issues 1-2, pages 56-66
Skin Pharmacology and Physiology, 2013, issue 2, pages 57-67"
quercus,POOR,Plant Extracts,none
Quercus infectoria extract,POOR,Plant Extracts,none
quillaja extract,GOOD,Plant Extracts,"Extract of the Chilean soap bark tree. It contains a good amount of saponins, which have cleansing and water-binding properties for skin."
quince seed,POOR,Plant Extracts,"Used as a thickening agent in cosmetics, but also has astringent properties and may cause skin sensitivity."
quinoa oil,GOOD,Plant Extracts,"Derived from quinoa grain, It may have emollient properties for skin, but there is little research showing this to be the case."
rapeseed oil,BEST,Antioxidants,"Nonfragrant oil that has emollient and potential antioxidant properties for skin and is a rich source of omega-3 and omega-6 fatty acids.
References for this information:
British Journal of Nutrition, May 2002, issue 5, pages 489–499"
raspberry seed extract,GOOD,Antioxidants,none
raspberry seed oil,GOOD,Antioxidants,none
red 27 lake,GOOD,Coloring Agents/Pigments,none
red 33,GOOD,Coloring Agents/Pigments,none
red 6 lake,GOOD,Coloring Agents/Pigments,none
red algae,GOOD,Antioxidants,none
red clover,GOOD,Skin-Soothing,"Can have antioxidant and skin-soothing properties.
References for this information:
Photochemistry and Photobiology, September 2001, pages 465–470"
red raspberry extract,GOOD,Antioxidants,"Fruit extract that has potent antioxidant properties. It also can cause sensitivity due to its tannin content.
References for this information:
Journal of Agricultural Food Chemistry, June 2002, issue 12, pages 3495–3500"
reducing agent,GOOD,Cleansing Agents,"Versatile ingredient composed of several non-volatile alcohols. Functions as a skin-replenishing agent, emulsifier, solvent, and surfactant."
resveratrol,BEST,Skin-Soothing,"Potent polyphenolic antioxidant abundant in red grapes and, therefore, in red wine. 
Applied topically, resveratrol helps protect skin’s surface and helps rebuff negative environmental influences. It also has significant skin-calming properties that may help minimize the look of redness. 
References for this information:
Journal of Drugs in Dermatology, December 2013, pages 1389-1394
Archives of Biochemistry and Biophysics, April 2011, pages 164-170
Antioxidants and Redox Signaling, December 2001, pages 1041-1064"
retinol,BEST,Antioxidants,"Name for the entire vitamin A molecule. Retinol is a powerhouse ingredient that has value for skin on several fronts: It’s a skin-restoring, wrinkle-smoothing, firming ingredient and an antioxidant, allowing it to improve a variety of skin concerns, most related to visible signs of aging.
Packaging is a key issue, so any container that lets in air (like jar packaging) or sunlight (clear containers) just won’t cut it. Lots of retinol products come in unacceptable packaging; these should be avoided because the retinol will most likely be (or quickly become) ineffective. Look for opaque, airless, or air-restrictive packaging.
Many consumers are concerned about the percentage of retinol in anti-aging products such as serums or moisturizers. Although the percentage can make a difference (especially if it’s too low), it’s not helpful in understanding how a retinol product will benefit your skin. Far more important is the delivery system, packaging, and the other ingredients present with the retinol. 
Using a product with a range of anti-aging ingredients plus retinol is far more valuable for skin than using a product with only a supposedly high percentage of retinol. Skin needs far more than any one ingredient can provide, however great that one ingredient may be. See our article on this topic for detailed information.
There are several myths about using retinol with other anti-aging ingredients or products, such as those with vitamin C or exfoliants like glycolic acid. See our article on this topic to learn what the research has shown to be true.
References for this information:
Journal of Drugs in Dermatology, March 2015, pages 271-280
Dermatology, May 2014, pages 314-325
Dermatoendocrinology, July 2012, issue 3, pages 308-319
Toxicological Research, March 2010, pages 61-66
Archives of Dermatology, May 2007, pages 606-612
The Journal of Pathology, January 2007, issue 2, pages 241-251
Clinical Interventions in Aging, December 2006, pages 327-348"
retinyl ascorbate,BEST,Antioxidants,"An ester of vitamin A (retinoic acid) and vitamin C (ascorbic acid) that functions as an antioxidant that seems to have a particular affinity for skin and its lipids, making it an effective topical option for improving skin's defense against environmental damage. This mix also shows greater stability in skin than when retinol or vitamin C are used alone.
References for this information:
Pharmazie, October 2005, pages 794-795
Skin Pharmacology and Physiology, November-December 2004, issue 6, pages 274-282
International Journal of Pharmaceutics, August 2004, issues 1-2, pages 113-124"
retinyl palmitate,BEST,Antioxidants,"Combination of retinol (pure vitamin A) and the fatty acid palmitic acid. Research has shown it to be an effective antioxidant when applied to skin. You may be surprised to learn that retinyl palmitate is found naturally in our skin, where it works as an antioxidant, particularly in regard to helping protect skin from UV light exposure—though it does not replace the need for sunscreen.
Reports that retinyl palmitate is not a safe ingredient are false. They’re based on a study from nearly 20 years ago that has never been reproduced or tested under real-life conditions such as how people use sunscreens that contain this ingredient. In addition, to date, there is no scientific evidence that retinyl palmitate is a carcinogen in humans. The safety of retinyl palmitate is supported by several accredited organizations and their opinions are widely available online. If you still have concerns, we encourage you to research the topic further.
References for this information:
Journal of Biomedical Nanotechnology, February 2016, pages 394-403
Acta Biochimica Polonica, 2015, pages 201-206
Clinical Interventions in Aging, December 2006, pages 327-348
Journal of Investigative Dermatology, November 2003, pages 1163-1167"
retinyl retinoate,BEST,Skin-Restoring,"Synthetic, “new generation” retinol with research showing its usefulness for restoring and improving signs of aging in skin. Retinyl retinoate has been shown, in limited but promising research (most coming from the same team of Korea-based researchers), to be less sensitizing than retinoic acid (prescription-strength) and cosmetic retinol. Retinyl retinoate may be less sensitizing than pure retinol because of its slower conversion in skin to retinoic acid. However, when it comes to sensitivity from retinol, there’s much that can be done using time-release delivery systems and ingredient additions to maximize its benefits to skin while minimizing, if not eliminating, its risk of sensitivity.
Although there’s reason to consider retinyl retinoate if your skin seems intolerant of cosmetic retinol, it shouldn’t be construed as better or safer for skin than such alternatives.
References for this information:
Dermatology Research and Practice, 2010
Cutis, October 2008, issue 4, pages 281-284
The Chemistry and Manufacture of Cosmetics. Allured Publishing Corp. 2002, pages 833-839"
Rhodiola rosea root extract,BEST,Antioxidants,"The extract of the plant Rhodiola rosea, also known as Arctic root or golden root, that is high in antioxidants and flavonoids. Research has shown it can help improve the appearance of fine lines and wrinkles.
References for this information:
Archives of Dermatological Research, April 2010, pages 191-200"
riboflavin,AVERAGE,Vitamins,none
rice bran oil,GOOD,Plant Extracts,Emollient oil similar to other non-fragrant plant oils. Research has not shown that it has any superior benefit for skin.
rice oil,GOOD,Plant Extracts,Emollient similar to other nonfragrant plant oils. There is no research showing this has any superior benefit for skin.
rice starch,GOOD,Plant Extracts,"Absorbent substance sometimes included in products rather than talc. Rice starch has a drier finish than talc, and is sometimes used in high amounts in powders meant for those with very oily skin."
ricinoleate,GOOD,Texture Enhancer,Glyceryl triester used in cosmetics as a thickening agent and emollient.
Ricinus communis,GOOD,Plant Extracts,none
Robinia pseudacacia extract,POOR,Antioxidants,none
Rosa canina,GOOD,Antioxidants,none
Rosa centifolia,GOOD,Antioxidants,none
Rosa centifolia flower,GOOD,Antioxidants,none
Rosa damascena oil,POOR,Plant Extracts,"Oil of a very fragrant pink rose used as fragrance in cosmetics. Extensive research has shown it has mixed benefits. In the pro column, inhaling this flower’s scent seems to have relaxing properties and the plant’s petals contain skin-soothing and antioxidant compounds that can benefit skin.
On the flipside, the numerous chemicals that create this rose’s distinctive fragrance pose a risk of causing skin aggravation.
Reference for this information:
Iranian Journal of Basic Medical Sciences, July-August 2014, pages 295-307"
Rosa eglanteria,GOOD,Antioxidants,none
Rosa gallica flower extract,POOR,Plant Extracts,Fragrant extract.
Rosa mosqueta,GOOD,Antioxidants,none
Rosa roxburghii extract,BEST,Antioxidants,"Extract from the chestnut rose; can be a source of antioxidants for skin, and does not impart fragrance.
References for this information:
International Journal of Clinical Chemistry and Applied Molecular Biology, November 2001, pages 37–43"
Rosa rubiginosa,GOOD,Antioxidants,none
rose flower,POOR,Plant Extracts,Highly fragrant substance that can aggravate skin.
rose flower oil,POOR,Plant Extracts,"Fragrant, volatile oil that can aggravate skin. There’s no research showing this has any benefit for skin, although components of rose can have soothing and antioxidant effects on skin.
References for this information:
Iranian Journal of Basic Medical Sciences, July-August 2014, issue 4, pages 295-307"
rose hip,GOOD,Antioxidants,none
rose hip oil,GOOD,Antioxidants,"Non-fragrant emollient plant oil that has antioxidant properties and is a rich source of skin-beneficial fatty acids.
References for this information:
AAPS Pharm SciTech, August 2016, pages 863-871
The Journal of Nutrition, March 2002, pages 461-471
Journal of Agricultural and Food Chemistry, March 2000, pages 825-828"
rosemary extract,GOOD,Plant Extracts,"Extract that can have antioxidant benefit for skin, but its aromatic components can cause sensitivity. However, in most skincare products the amount of rosemary extract is unlikely to be a risk, and rosemary extract is much less of a problem for skin than rosemary oil because the extract usually doesn’t contain much, if any, of rosemary oil’s volatile fragrance components.
Research has shown that rosmarinic acid, one of the components in rosemary extract, has a calming effect on skin, which may be useful for mitigating several common skin issues. Rosmarinic acid is an antioxidant, as is caffeic acid, another naturally occurring component of rosemary. 
See rosemary oil
References for this information:
Pharmacognosy Review, January-June 2014, pages 52-60
Journal of Medicinal Food, April 2013, pages 324-333
Chemical Research in Toxicology, November 2001, issue 4, pages 1546-1551
Journal of Agricultural and Food Chemistry, September 1999, issue 10, pages 3,954-3,962"
rosemary oil,POOR,Antioxidants,"Fragrant plant oil derived from rosemary (Latin name Rosmarinus officinalis). This ingredient is used primarily as a fragrance in cosmetics, but the volatile chemicals that give it its fragrance (camphor is among them) are also capable of causing sensitivity when applied to skin."
rose oil,POOR,Plant Extracts,"Fragrant, volatile oil that can aggravate skin."
rosewood oil,POOR,Plant Extracts,"Fragrant plant oil with a spicy-sweet scent, also known as bois de rose. Extracted from wood chips from a species of evergreen tree, rosewood oil contains several volatile fragrance chemicals, including camphene, geranial, geraniol, limonene, linalool, myrcene, and neral. Rosewood oil is used chiefly as a fragrance and flavoring ingredient; there’s no research pertaining to its benefit for skin."
Rosmarinus officinalis extract,POOR,Antioxidants,none
royal jelly,AVERAGE,Uncategorized,"The myriad claims about royal jelly are anecdotal and have no research to substantiate them. Regardless of where the royal jelly is sourced, its chemical breakdown is mostly water, followed by proteins, sugars,  a tiny amount of fats and trace amonuts of vitamins, minerals, and enzymes. None of this is the key to improved signs of aging, though components in royal jelly can function as water-binding agents. Not surprisingly, topical application of this bee-produced ingredient can aggravate skin. However, it is rarely used in high enough concentrations to cause problems.
Royal jelly is highly unstable and will break down if packaged in a jar that routinely exposes it to light and air. Also, ideally, it requires refrigeration to maintain efficacy."
Rubus idaeus,GOOD,Antioxidants,none
Rubus occidentalis,BEST,Antioxidants,none
Rubus ursinus,GOOD,Antioxidants,none
Rubus ursinus x idaeus,BEST,Antioxidants,none
Rubus villoscus,BEST,Antioxidants,"The Latin name for blackberry fruit extract. This plant extract has antioxidant ability that stems from its phenolic acid content. Antioxidant components of blackberry fruit include ferulic acid, caffeic acid, and quercetin, among many others. As with all berries, blackberries are a brilliant source of naturally-occurring antioxidants that benefit skin when applied topically (Sources: Journal of Zhejiang University, February 2012, pages 94-102; Journal of Agricultural and Food Chemistry, ePublication, December 8, 2011; and www.naturaldatabase.com)."
Ruscus aculeatus,AVERAGE,Skin-Soothing,none
rutin,BEST,Antioxidants,Bioflavonoid that is extracted from various plants and used in cosmetics as an antioxidant and emollient.
saccharide isomerate,GOOD,Emollients,"Good water-binding agent and emollient for skin, and particularly helpful for dry skin."
saccharides,BEST,Skin-Replenishing,none
Saccharomyces calcium ferment,AVERAGE,Miscellaneous,Extract of yeast fermented in the presence of calcium ions. It has no known benefit for skin but theoretically could help boost hydration.
Saccharomyces cerevisiae,AVERAGE,Skin-Replenishing,"Saccharomyces, from the Latin, literally means ""sugar fungus,"" and is the scientific name for the yeasts used in fermentation, specifically baker’s yeast. Cosmetic ingredient manufacturers extol this yeast as having significant properties for skin, but there is little independent research supporting its use. However, some extracts of yeast, such as beta-glucan (a potent antioxidant) are derived from yeast.
References for this information:
Proceedings of the National Academy of Sciences, August 15, 1989, pages 6018–6022
http://www.in-cosmetics.com/ExhibitorLibrary/3/BiodynesO3.pdf"
Saccharomyces copper ferment,AVERAGE,Antioxidants,"Extract of yeast fermented in the presence of copper ions. There is no known benefit for skin, though it may have antioxidant properties."
Saccharomyces iron ferment,AVERAGE,Antioxidants,Extract of yeast fermented in the presence of iron ions.
